{
  "farhp_weblab_syllable_version": "0.5",
  "generated_at": "2026-07-27T03:26:35.004Z",
  "phonology": {
    "bopomofo": "ㄇㄚˇ",
    "initial": "ㄇ",
    "final": "ㄚ",
    "tone": 3,
    "tone_name": "第三聲",
    "sihu": "開口呼",
    "coda": "無",
    "category_check": true
  },
  "acoustics": {
    "sample_rate_hz": 24000,
    "duration_sec": 0.78,
    "base_f0_hz": 132,
    "f0_min_hz": 93.33855438232422,
    "f0_max_hz": 135.0785675048828,
    "onset_model": "nasal",
    "residual_strength": 0.52,
    "tone_trajectory": [
      {
        "u": 0,
        "semitones": -1,
        "f0_hz": 124.59140927398354
      },
      {
        "u": 0.0625,
        "semitones": -1.694852773982574,
        "f0_hz": 119.68979898742545
      },
      {
        "u": 0.125,
        "semitones": -2.296641124773221,
        "f0_hz": 115.60078295935668
      },
      {
        "u": 0.1875,
        "semitones": -2.8676776635805252,
        "f0_hz": 111.84996391474645
      },
      {
        "u": 0.25,
        "semitones": -3.4196178951936176,
        "f0_hz": 108.34028354089996
      },
      {
        "u": 0.3125,
        "semitones": -3.9577795338283845,
        "f0_hz": 105.0242853179851
      },
      {
        "u": 0.375,
        "semitones": -4.485209755354025,
        "f0_hz": 101.87290917427688
      },
      {
        "u": 0.4375,
        "semitones": -5.0038798050984665,
        "f0_hz": 98.866108070284
      },
      {
        "u": 0.5,
        "semitones": -5.515166646256989,
        "f0_hz": 95.98898113042979
      },
      {
        "u": 0.5625,
        "semitones": -5.980447342808777,
        "f0_hz": 93.44357125099957
      },
      {
        "u": 0.625,
        "semitones": -5.248418752223809,
        "f0_hz": 97.47942865068401
      },
      {
        "u": 0.6875,
        "semitones": -4.401604002928865,
        "f0_hz": 102.36606953908156
      },
      {
        "u": 0.75,
        "semitones": -3.50128335756232,
        "f0_hz": 107.8304261869921
      },
      {
        "u": 0.8125,
        "semitones": -2.5640587871786904,
        "f0_hz": 113.82885851723209
      },
      {
        "u": 0.875,
        "semitones": -1.5982963828259065,
        "f0_hz": 120.35921182952764
      },
      {
        "u": 0.9375,
        "semitones": -0.6091162465720101,
        "f0_hz": 127.4364728799329
      },
      {
        "u": 1,
        "semitones": 0.39999999999999947,
        "f0_hz": 135.0853537435743
      }
    ]
  },
  "farhp": {
    "source": "curved",
    "strength": 1,
    "anchor_phase_rad": 0.35,
    "harmonic_count": 24,
    "quantization_bins": 16,
    "values": [
      0.4650483399593899,
      0.5823812584220409,
      0.6899999999999995,
      0.7936667527999326,
      0.8963367176906161,
      0.9997654195406689,
      1.1050966799187805,
      1.2131249999999998,
      1.3244288512538809,
      1.4394449329137284,
      1.5585125168440825,
      1.6819014081484767,
      1.8098303637676612,
      1.9424796707863727,
      2.08,
      2.2225188001976512,
      2.370145019878171,
      2.522972661933016,
      2.681083505599865,
      2.8445492223858686,
      3.013433043143497,
      -3.095394219719516,
      -2.915511871798353
    ]
  },
  "decomposition": "phonology + f0(t) tone + FARHP + onset/coda residual",
  "warning": "browser MVP synthesis; not a natural-speech TTS or physiological model"
}